CODE,ADDRESS,featuredLevel,publishDate,price,numBedrooms,numBathrooms,propertyType,propertySize,category,AMV_price,sellerId,seller_name,seller_branch,sellerType,m_totalImages,m_hasVideo,m_hasVirtualTour,m_hasBrochure,ber_rating,longitude,latitude,LONGITUDE,LATITUDE
3691632,"25 High Park, Drumcondra, Dublin 9, D09 P0E2, Ireland",standard,2022-01-29,495000,3,3,Semi-D,116.0,Buy,0,3242.0,Douglas Hurley,DNG O'Sullivan Hurley Property & Financial Services,BRANDED_AGENT,2.0,False,False,False,A3,-9.441683,52.773346,-6.241875599999999,53.37989839999999
3691628,"Apartment 13, Talbot Hall, Thornleigh Rd, Thornleigh, Swords, Co. Dublin, Ireland",standard,2022-01-29,199000,2,2,Apartment,62.0,Buy,0,2419.0,Cathal Mc Carthy,DNG Rathfarnham,BRANDED_AGENT,11.0,False,True,False,F,-6.281225,53.29833,-6.233837400000001,53.4745317
3691627,"78, 1 Jervis St, North City, Dublin, Ireland",standard,2022-01-29,320000,2,1,Apartment,56.0,Buy,0,9917.0,Wayne O'Brien,DNG Fairview,BRANDED_AGENT,15.0,False,False,False,C3,-6.221285,53.375933,-6.267167499999999,53.3499541
3691624,"13 Applewood Close, Applewood, Swords, Co. Dublin, K67 E206, Ireland",standard,2022-01-29,210000,1,1,Apartment,52.0,Buy,0,10104.0,Marc Browne,DNG Tallaght,BRANDED_AGENT,24.0,False,False,False,C1,-6.340281,53.271284,-6.230444299999999,53.47061670000001
3691630,"63 Lioscian, Rathbeale Rd, Outlands, Swords, Co. Dublin, K67 WK35, Ireland",standard,2022-01-29,380000,4,4,Terrace,112.0,Buy,0,7569.0,Clondalkin Sales,Ray Cooke Auctioneers Clondalkin,BRANDED_AGENT,20.0,False,False,False,XXX,-6.4121251,53.3239461,-6.241757499999999,53.4639282
3691452,"24 Larkfield View, Ballyowen, Lucan, Co. Dublin, K78 WA22, Ireland",standard,2022-01-30,369000,3,2,End of Terrace,103.0,Buy,0,2299.0,Mark O'Donoghue,Hickey O'Donoghue Auctioneers Ltd.,BRANDED_AGENT,21.0,False,False,False,E2,-8.630994,52.669017,-6.4182163,53.3525471
3691450,"Dungarvan, 472 Howth Rd, Clontarf East, Dublin 5, D05 WR68, Ireland",standard,2022-01-28,950000,5,4,Detached,208.0,Buy,0,2299.0,Mark O'Donoghue,Hickey O'Donoghue Auctioneers Ltd.,BRANDED_AGENT,22.0,False,False,False,C3,-8.619542,52.68304,-6.1822287,53.37884949999999
3691435,"24 Belcamp Cres, Priorswood, Dublin, D17 NY68, Ireland",standard,2022-01-28,180000,3,1,Terrace,130.0,Buy,1,10094.0,Mark Conroy - Sales,Mark Charles Properties,BRANDED_AGENT,14.0,False,False,False,C3,-7.46806,53.264177,-6.196897,53.4036205
3691428,"2 The Close, Mount Merrion, Blackrock, Co. Dublin, A94 NX27, Ireland",standard,2022-01-30,1050000,3,4,Semi-D,161.0,Buy,0,2248.0,REA Eoin Dillon,REA Eoin Dillon,UNBRANDED_AGENT,12.0,False,False,False,D2,-8.1916454,52.8543261,-6.2097465,53.2994215
3689493,"16 Hunters Ave, Ballycullen, Dublin, Ireland",standard,2022-01-28,485000,5,3,End of Terrace,146.0,Buy,0,1325.0,Donal Barry,Sherry FitzGerald O'Donovan,BRANDED_AGENT,29.0,False,False,False,C1,-8.282814,52.133044,-6.3307629,53.2718011
3689895,"Apartment 2, 32/33 Gardiner Street Upper, Rotunda, Dublin, D01 PX74, Ireland",standard,2022-01-26,185000,1,1,Apartment,52.0,Buy,0,2664.0,Maria Walsh,Sherry FitzGerald Castleknock,BRANDED_AGENT,8.0,False,False,False,C3,-6.315406,53.376483,-6.2610958,53.3583511
3691352,"46 Hunters Ave, Ballycullen, Dublin, Ireland",standard,2022-01-28,260000,2,2,Apartment,73.0,Buy,0,8806.0,Isabelle Crean,BidX1,BRANDED_AGENT,2.0,False,False,False,F,-6.326321,53.339365,-6.332571,53.2715154
3691386,"Hazelbrook Square, Whitehall, Dublin, Ireland",standard,2022-01-28,775000,4,3,Terrace,155.0,Buy,0,8806.0,Ian McCarthy,BidX1,BRANDED_AGENT,10.0,False,False,False,D1,-8.216521,52.865047,-6.2679396,53.2938053
3691380,"12 Village Gate, Dalkey, Co. Dublin, A96 VF89, Ireland",standard,2022-01-29,595000,2,1,Townhouse,66.0,Buy,0,8806.0,Ian McCarthy,BidX1,BRANDED_AGENT,20.0,False,False,False,C3,-8.515082,51.897097,-6.1072604,53.27519909999999
3691372,"16 Hunters Grove, Hunters Wood, Dublin 24, D24 R880, Ireland",standard,2022-01-27,425000,3,3,Terrace,,Buy,0,8806.0,Daniel Larkin,BidX1,BRANDED_AGENT,3.0,False,False,False,XXX,-7.49066,55.278942,-6.327783999999999,53.26918939999999
3691320,"4 Melrose Cres, Clonburris Great, Dublin 22, D22 E264, Ireland",standard,2022-01-30,225000,3,1,Terrace,82.0,Buy,0,2830.0,Jackie Feighery,Sherry FitzGerald Talbot,BRANDED_AGENT,7.0,False,False,False,C1,-8.216146,52.859837,-6.419526299999999,53.3268389
3691223,"88 Bangor Rd, Crumlin, Dublin 12, D12 R9V6, Ireland",standard,2022-01-27,349950,2,2,Terrace,139.0,Buy,0,3955.0,Sales Department,Moloney Auctioneers,BRANDED_AGENT,28.0,False,False,False,D1,-6.998737,52.41121,-6.3020871,53.32526350000001
3691221,"5 Kilgobbin Heights, Kilgobbin, Dublin 18, D18 F7H2, Ireland",standard,2022-01-28,1450000,4,3,Detached,217.0,Buy,0,9422.0,Gareth,Glen Estates,UNBRANDED_AGENT,15.0,True,False,False,SI_666,-7.725389,54.971774,-6.214858,53.2553993
3691213,"33 Mountjoy Square, Mountjoy, Dublin, Ireland",standard,2022-01-28,225000,1,1,Apartment,85.0,Buy,0,3983.0,Paula Treacy,Paula Treacy Estates,BRANDED_AGENT,27.0,False,False,False,SI_666,-6.574137,52.511575,-6.2554333,53.3561492
3691214,"43 Waterville Row, Dublin, Ireland",standard,2022-01-27,260000,2,2,Apartment,68.0,Buy,0,3853.0,Blue Sky Property,Blue Sky Property,BRANDED_AGENT,37.0,False,False,False,B3,-6.241421,54.019664,-6.3774469,53.3922134
3691192,"34A Huntstown Rd, Blakestown, Dublin 15, D15 WY81, Ireland",standard,2022-01-26,275000,3,1,Semi-D,71.0,Buy,0,1916.0,Austin Reynolds,Property Partners Paul Reynolds & Co.,BRANDED_AGENT,9.0,False,False,False,SI_666,-7.874574,54.956327,-6.408042999999999,53.399605
3691183,"Santry, Dublin, Ireland",standard,2022-01-28,275000,2,2,Apartment,80.0,Buy,0,3509.0,Tom Stuart,Stuart & Company Auctioneers & Valuers,UNBRANDED_AGENT,15.0,False,False,False,SI_666,-9.466464,52.25545,-6.245105499999999,53.3973571
3682482,"8 Hazelwood Park, Beaumont, Dublin 5, D05 T6V0, Ireland",standard,2022-01-28,490000,3,1,Semi-D,101.0,Buy,0,3230.0,Roy Dennehy,Dennehy Auctioneers,BRANDED_AGENT,20.0,False,False,False,C1,-8.404498,51.801941,-6.210984000000001,53.38733149999999
3691111,"Westend Village, Snugborough Rd, Blanchardstown, Dublin 15, Ireland",standard,2022-01-28,250000,2,1,Apartment,95.0,Buy,0,769.0,Tony Donnelly  MIPAV,RE/MAX Partners,BRANDED_AGENT,27.0,False,True,False,B3,-7.05979,53.140226,-6.390667499999999,53.3886042
3691072,"3 Grange View Way, Kilmahuddrick, Dublin 22, D22 V088, Ireland",standard,2022-01-28,245000,3,1,Terrace,51.0,Buy,1,2652.0,Pippy Proger,Sherry FitzGerald Dun Laoghaire,BRANDED_AGENT,8.0,True,False,False,D2,-6.137898,53.279254,-6.430480500000001,53.3249941
3691064,"46 Castlecurragh Vale, Buzzardstown, Dublin 15, D15 H6H9, Ireland",standard,2022-01-26,199950,2,1,Duplex,,Buy,0,8806.0,Isabelle Crean,BidX1,BRANDED_AGENT,4.0,False,False,False,G,-7.864554,51.963525,-6.3898147,53.40370220000001
3691055,"83 Cabra Rd, Cabra East, Dublin 7, D07 TH6X, Ireland",standard,2022-01-28,810000,7,7,Terrace,,Buy,0,8806.0,Isabelle Crean,BidX1,BRANDED_AGENT,2.0,False,False,False,C2,-9.08806,51.808458,-6.2826653,53.3612024
3691030,"1 Forest Ave, Forestfields, Swords, Co. Dublin, K67 Y8N9, Ireland",standard,2022-01-27,365000,3,2,Detached,81.0,Buy,0,11939.0,Ryan Carroll,Leinster Property Consultants,UNBRANDED_AGENT,20.0,False,False,False,C2,-6.547281,53.854876,-6.2406274,53.4508816
3690977,"31 Glenbrook Park, Rathfarnham, Dublin, D14 P284, Ireland",standard,2022-01-30,695000,4,2,Semi-D,140.0,Buy,0,418.0,Luke Roe,McGovern Estates,BRANDED_AGENT,26.0,False,False,False,B3,-6.075675,53.130616,-6.2893901,53.2946924
3581654,"12 Stocking Wood Copse, Ballycullen, Dublin, Ireland",standard,2022-01-28,315000,2,2,Apartment,72.0,Buy,0,9315.0,Shane May,iamsold,BRANDED_AGENT,14.0,False,False,False,C3,-9.644139,52.68381,-6.3193256,53.27188049999999
3690903,"179 Jamestown Rd, Finglas North, Dublin 11, D11 YX24, Ireland",standard,2022-01-26,369950,3,1,Semi-D,60.0,Buy,0,10947.0,Northside Sales 2,Ray Cooke Auctioneers Finglas,BRANDED_AGENT,19.0,True,False,False,C2,-6.289352,53.379989,-6.2924111,53.39673459999999
3690894,"47 Melville Way, Jamestown Little, Dublin, Ireland",standard,2022-01-26,245000,2,2,Apartment,,Buy,0,3438.0,Joe Wheeler,Wheeler Auctioneers Ltd,BRANDED_AGENT,11.0,False,False,False,C3,-8.64034,52.63288,-6.2937593,53.4004182
3690871,"9 Halston St, Dublin, Ireland",standard,2022-01-30,715000,7,3,Terrace,110.0,Buy,0,8166.0,Colm Farrell,"Farrell Auctioneers, Valuers, & Estate Agents Ltd",UNBRANDED_AGENT,15.0,False,False,False,D2,-8.811888,53.012782,-6.271443499999999,53.3496876
3690873,"275 Harold's Cross Rd, Harold's Cross, Dublin 6W, Co. Dublin, D6W X603, Ireland",standard,2022-01-30,725000,3,2,Semi-D,86.0,Buy,0,2872.0,Angela Horan,Sherry FitzGerald Catherine O'Reilly,BRANDED_AGENT,23.0,False,False,False,B3,-6.225195,53.069818,-6.2798114,53.3173014
3690837,"4 Ravenswell, Rush Demesne, Rush, Co. Dublin, K56 RK15, Ireland",standard,2022-01-26,285000,2,2,End of Terrace,97.0,Buy,0,1965.0,Deirdre D'Arcy MIPAV MMCEPI,DNG Maxwell Heaslip & Leonard,BRANDED_AGENT,13.0,False,False,False,D1,-9.047488,53.28435,-6.0937101,53.53211109999999
3690771,"Apartment 23, Richmond Hall, Milltown Ave, Mount St Annes, Dublin 6, Ireland",standard,2022-01-30,695000,2,2,Apartment,97.0,Buy,0,2762.0,Paul Stack,Sherry FitzGerald Stack,BRANDED_AGENT,14.0,False,False,False,E2,-9.301942,52.387851,-6.249276399999999,53.3115075
3690764,"20 Maple Rd, Farranboley, Dublin 14, D14 DA38, Ireland",standard,2022-01-30,1850000,4,4,Detached,290.0,Buy,0,8273.0,Hamill Estate Agents & Valuers,Hamill Estate Agents & Valuers,BRANDED_AGENT,19.0,False,True,False,C1,-6.308583,53.397954,-6.2410276,53.309713
3690762,"23 Stradbrook Park, Montpelier, Blackrock, Co. Dublin, A94 WK59, Ireland",standard,2022-01-30,695000,3,1,Bungalow,86.0,Buy,0,1186.0,Office,The Property Shop,BRANDED_AGENT,14.0,True,False,False,B3,-6.481931,53.413045,-6.1646958,53.2930418
3690766,"Kenmare House, N Great George's St, Rotunda, Dublin 1, Ireland",standard,2022-01-26,210000,1,1,Apartment,43.0,Buy,0,1091.0,Jerry Flynn & Associates,Jerry Flynn & Co.,UNBRANDED_AGENT,13.0,False,False,False,E1,-9.302428,52.38499,-6.260323199999999,53.3539146
3690731,"134 Kincora Rd, Clontarf, Dublin 3, D03 XW14, Ireland",standard,2022-01-26,750000,3,1,Semi-D,106.0,Buy,0,1481.0,Caroline Bergin,CBPM Real Estate,BRANDED_AGENT,11.0,False,False,False,C2,-7.27124,53.049218,-6.1928217,53.3618993
3690687,"Wellington Lodge, Serpentine Ave, Ballsbridge, Dublin 4, Ireland",standard,2022-01-28,325000,1,1,Apartment,43.0,Buy,0,2581.0,Charles McCarthy,Charles McCarthy Auctioneers,BRANDED_AGENT,15.0,False,False,False,F,-9.415603,51.5168449,-6.2249972,53.3289427
3690632,"39 Greenville Terrace, Saint Catherine's, Dublin 8, D08 N2V4, Ireland",standard,2022-01-30,675000,2,1,Terrace,79.0,Buy,0,84.0,Flynn & Associates Swords,Flynn & Associates Ltd (Swords),BRANDED_AGENT,20.0,False,False,False,XXX,-6.2307149,53.4695055,-6.2784271,53.3330563
3690617,"2 Fownes Street Upper, Temple Bar, Dublin 2, D02 NY23, Ireland",standard,2022-01-28,900000,1,1,Terrace,112.0,Buy,1,8505.0,Rory Gallagher,Gallagher Quigley,BRANDED_AGENT,18.0,False,False,False,D1,-6.126585,53.394192,-6.2634164,53.3444194
3217229,"100 Tudor Lawns, Galloping Green South, Dublin 18, D18 ET02, Ireland",standard,2022-01-26,650000,3,3,Semi-D,100.0,Buy,0,2835.0,Cormac Curran,Sherry FitzGerald Reynolds,BRANDED_AGENT,26.0,False,False,False,B3,-7.645578,52.085173,-6.193345100000001,53.271787
3690564,"76 Sandymount Rd, Dublin 4, D04 XP79, Ireland",standard,2022-01-28,1100000,3,1,Semi-D,131.0,Buy,0,5489.0,Edel Keane Assoc. RICS BSc (Hons),Keane Auctioneers,BRANDED_AGENT,30.0,False,False,False,B3,-6.495989,52.326477,-6.2167748,53.33364419999999
3690551,"9 St Brigid's Ave, N Strand Rd, North Dock, Dublin 3, D03 NV32, Ireland",standard,2022-01-28,435000,3,3,Terrace,122.0,Buy,0,1227.0,Tommy Breheny,Oates Breheny Group,BRANDED_AGENT,8.0,False,False,False,C1,-8.460196,54.258716,-6.2394712,53.3586813
3690484,"15 Carrigmore Ave, Coldwater Commons, Saggart, Co. Dublin, D24 PP79, Ireland",standard,2022-01-27,295000,3,3,Duplex,,Buy,0,893.0,Karl Craven,ALLIANCE AUCTIONEERS,BRANDED_AGENT,15.0,False,False,False,C3,-6.393157,53.376383,-6.429735,53.2808056
3690481,"28 Cypress Grove S, Templeogue Village, Dublin 6W, Co. Dublin, D6W T355, Ireland",standard,2022-01-28,750000,4,2,Semi-D,130.0,Buy,0,3766.0,John Quinn,John Quinn Auctioneers,UNBRANDED_AGENT,14.0,False,False,False,G,-9.025779,53.275435,-6.3110293,53.29681
3689629,"Trimbleston, Goatstown Rd, Friarland, Dublin 14, Ireland",standard,2022-01-28,495000,2,2,Apartment,72.0,Buy,0,2607.0,Graham Gaughran,DNG Terenure,BRANDED_AGENT,12.0,False,False,False,E2,-6.31506,53.312315,-6.2321859,53.29894729999999
3689968,"181 Comeragh Rd, Drimnagh, Dublin, D12 XN20, Ireland",standard,2022-01-30,319950,2,1,Semi-D,210.0,Buy,0,925.0,Paul Clarke BSc (Hons) MSc,DNG Duffy,BRANDED_AGENT,20.0,False,True,False,B3,-6.676491,53.898437,-6.327499,53.3295877
3690367,"79, 109 Parnell St, Rotunda, Dublin 1, Ireland",standard,2022-01-28,210000,1,1,Apartment,88.0,Buy,0,911.0,Dermot Gilchrest,Sherry FitzGerald Galway,BRANDED_AGENT,14.0,False,False,False,C1,-8.928016,53.263119,-6.2575639,53.35394969999999
3690406,"286 St James's Rd, Dublin 12, D12 T2N1, Ireland",standard,2022-01-30,395000,3,1,Terrace,94.0,Buy,0,10947.0,Northside Sales 2,Ray Cooke Auctioneers Finglas,BRANDED_AGENT,12.0,False,False,False,D1,-6.3925159,53.3885189,-6.3404165,53.30895779999999
3690403,"Apartment 1, The Poplar Lodge, The Woodlands, Rathfarnham, Dublin 14, Ireland",standard,2022-01-26,275000,1,1,Apartment,41.0,Buy,0,12282.0,Fair Deal Property,Fair Deal Property Ltd.,BRANDED_AGENT,21.0,False,False,False,C2,-8.899464,53.615921,-6.2812208,53.2983432
3690399,"61 Oak Rd, Grace Park, Dublin 9, D09 V6W2, Ireland",standard,2022-01-30,400000,3,2,Terrace,77.0,Buy,0,718.0,Darren Kelly,Noel Kelly Auctioneers LTD,BRANDED_AGENT,18.0,False,False,False,C1,-6.152224,53.419495,-6.221284799999999,53.3759331
3690398,"28 Oakdale Cres, Ballycullen, Dublin, Ireland",standard,2022-01-30,549000,4,3,Semi-D,128.0,Buy,0,10656.0,Fionnuala Tarpey,Tarpey Maloney Properties,UNBRANDED_AGENT,13.0,False,False,False,B3,-9.120481,53.273931,-6.3402276,53.2715402
3690369,"4 Lealand Rd, Bawnoges, Dublin 22, D22 X592, Ireland",standard,2022-01-29,249000,3,2,Terrace,79.0,Buy,0,1904.0,Andy Coghill,Destinations Athlone,UNBRANDED_AGENT,13.0,False,False,False,C3,-7.908002,53.423594,-6.4121251,53.3239461
3690370,"25 Magenta Cres, Whitehall, Dublin 9, D09 YY36, Ireland",standard,2022-01-28,369000,3,1,Terrace,90.0,Buy,0,8210.0,Ray Kelly (Residential Sales),HWP Residential and Commercial Property,BRANDED_AGENT,20.0,False,False,False,B3,-6.320545,53.395846,-6.243490299999999,53.3953131
3690366,"13 Holywell Villas, Feltrim Hall, Swords, Co. Dublin, K67 AP11, Ireland",standard,2022-01-29,285000,2,3,Terrace,,Buy,0,1966.0,Henry O'Leary,Henry O'Leary Auctioneers,UNBRANDED_AGENT,24.0,True,False,False,D1,-8.754367,51.742354,-6.212377099999999,53.4419631
3689972,"15 Bath St, Dublin 4, D04 P082, Ireland",standard,2022-01-30,750000,3,2,Terrace,117.0,Buy,0,5048.0,Vincent Walsh,Vincent Walsh Auctioneers,BRANDED_AGENT,22.0,False,False,False,E2,-9.070527,53.447332,-6.2222116,53.338755
3689973,"24 Beechdale Ct, Oldcourt, Dublin, Ireland",standard,2022-01-30,295000,2,2,Apartment,76.0,Buy,0,2587.0,Michael O'Donovan,Sherry FitzGerald O'Donovan Mallow,BRANDED_AGENT,23.0,False,False,False,B3,-8.629216,52.137211,-6.3364632,53.2691335
3689966,"Apartment 7, Cassian Court South, Lock-Keepers Walk, Royal Canal Park, Ashtown, Dublin 15, Ireland",standard,2022-01-30,295000,2,1,Apartment,64.0,Buy,0,10019.0,Serena Maguire,Sherry FitzGerald Foxrock,BRANDED_AGENT,19.0,True,False,False,C2,-6.216357,53.26945,-6.3163342,53.3766852
3689964,"3 Abercorn Terrace, Inchicore, Dublin 8, D08 TDK5, Ireland",standard,2022-01-28,400000,3,1,Terrace,61.0,Buy,1,10019.0,Emma Curran,Sherry FitzGerald Foxrock,BRANDED_AGENT,8.0,False,False,False,C3,-6.207516,53.259316,-6.3263131,53.3393671
3689956,"17 Greencastle Rd, Castle Elms, Priorswood, Dublin 17, D17 XY53, Ireland",standard,2022-01-28,175000,1,1,Apartment,190.0,Buy,1,6182.0,Louise Kenny,Lisney (Leeson St),BRANDED_AGENT,19.0,True,False,False,D2,-6.239868,53.321162,-6.197861899999999,53.3945896
3689917,"Apartment 52, Block C3, Geraldstown Woods, Santry Ave, Santry Demesne, Dublin 9, Ireland",standard,2022-01-28,210000,2,2,Apartment,61.0,Buy,0,2960.0,Peter Keaveney,Lansdowne Partnership Estate Agents,BRANDED_AGENT,32.0,False,True,True,E2,-6.28087,53.340745,-6.2605654,53.4010239
3689883,"8 Parkside Cres, Donaghmede, Dublin 13, D13 Y80F, Ireland",standard,2022-01-28,405000,3,3,Terrace,114.0,Buy,0,2646.0,Sean Tobin,Sherry FitzGerald Killester,BRANDED_AGENT,14.0,True,False,False,C2,-6.204089,53.366307,-6.1657405,53.4067425
3689869,"Herbert Park Ln, Dublin, Ireland",standard,2022-01-28,410000,1,1,Apartment,50.0,Buy,0,2867.0,Declan O'Leary,Sherry FitzGerald O'Leary Kinsella,BRANDED_AGENT,10.0,False,True,False,C2,-6.594339,52.511061,-6.2318967,53.3278224
3689829,"2 Strandmill Ave, Burrow, Portmarnock, Co. Dublin, D13 VF25, Ireland",standard,2022-01-26,490000,3,2,Terrace,100.0,Buy,0,3230.0,Roy Dennehy,Dennehy Auctioneers,BRANDED_AGENT,13.0,False,False,False,C3,-8.383199,51.821481,-6.1349779,53.42053139999999
3689805,"Malahow, Dublin Rd, Newtown, Drogheda, Co. Louth, Ireland",standard,2022-01-27,795000,4,3,Detached,205.0,Buy,0,2742.0,Joseph Coogan,Joseph Coogan Auctioneers,UNBRANDED_AGENT,21.0,False,False,False,C3,-7.390397,52.841572,-6.3317565,53.7086807
3689752,"Apartment 70, Carton House, The Oaks, Ridgewood, Swords, Co. Dublin, Ireland",standard,2022-01-26,275000,2,2,Apartment,72.0,Buy,0,2253.0,John O'Neill,REA O'Donoghue & Clarke,BRANDED_AGENT,5.0,False,False,False,SI_666,-9.478517,51.669706,-6.2430268,53.44610669999999
3454559,"Convent Ln, Rush, Co. Dublin, Ireland",standard,2022-01-25,695000,5,3,Detached,,Buy,0,11159.0,Padraig McNeill,McNeill Auctioneers,UNBRANDED_AGENT,11.0,False,False,False,F,-8.461328,53.694596,-6.0916246,53.5201213
3689720,"16 Wyckham Way, Dundrum, Dublin, Ireland",standard,2022-01-30,330000,1,1,Apartment,48.0,Buy,0,10777.0,David Tobin,DNG Raheny,BRANDED_AGENT,14.0,False,True,False,E2,-6.151825,53.3830092,-6.2434444,53.2824995
3689692,"25 Holywell Rise, Feltrim Hall, Swords, Co. Dublin, K67 KT22, Ireland",standard,2022-01-25,355000,3,2,End of Terrace,90.0,Buy,0,8806.0,Isabelle Crean,BidX1,BRANDED_AGENT,4.0,False,False,False,C1,-6.214265,53.443154,-6.213236500000001,53.443072
3689656,"43 Luttrellstown Ave, Carpenterstown, Dublin, D15 EVK7, Ireland",standard,2022-01-28,550000,3,2,Semi-D,,Buy,0,8806.0,Daniel Larkin,BidX1,BRANDED_AGENT,4.0,False,False,False,C2,-6.803449,53.081535,-6.391769699999999,53.3691632
3689624,"23 Cherry Ave, Forestfields, Swords, Co. Dublin, K67 WP20, Ireland",standard,2022-01-28,350000,3,1,Semi-D,88.0,Buy,0,7.0,Ross Kavanagh,Wyse Residential,BRANDED_AGENT,10.0,True,True,False,C3,-6.302431,53.348007,-6.2379536,53.4499602
3689617,"83 Bayside Blvd N, Kilbarrack Lower, Dublin 13, D13 X2W5, Ireland",standard,2022-01-28,339000,2,1,Terrace,,Buy,0,4028.0,Phillip Grimes,Capital Auctioneers,UNBRANDED_AGENT,14.0,False,False,False,SI_666,-6.408037,53.844061,-6.1428375,53.390241
3689436,"25 Blackthorn Ct, Sandyford, Dublin 16, D16 N206, Ireland",standard,2022-01-25,500000,3,1,Semi-D,88.0,Buy,0,5048.0,Vincent Walsh,Vincent Walsh Auctioneers,BRANDED_AGENT,38.0,False,False,False,B3,-9.049449,53.455107,-6.2231286,53.27585180000001
3689553,"County Dublin, North Dock, Dublin, Ireland",standard,2022-01-28,295000,2,1,Apartment,164.0,Buy,0,2714.0,Ian Smyth MRICS,Smyth Naas,BRANDED_AGENT,37.0,False,True,False,A3,-6.680261,53.211633,-6.2411522,53.3554423
3689554,"2 Sarsfield St, Glenageary, Sallynoggin, Co. Dublin, A96 P297, Ireland",standard,2022-01-30,395000,2,1,End of Terrace,51.0,Buy,0,2710.0,John Kelly  MIPAV REV MCEI,Kelly Hudson Properties,BRANDED_AGENT,33.0,False,False,False,C1,-6.661589,53.238745,-6.1378933,53.2792542
3689545,"Castlewarden, Co. Dublin, Ireland",standard,2022-01-28,125000,1,1,Detached,173.0,Buy,1,1218.0,DNG McCormack Clane Office,DNG McCormack  Properties,BRANDED_AGENT,25.0,True,False,False,E1,-6.60771,53.312235,-6.5334949,53.2749669
3689528,"1 Morehampton Terrace, Ranelagh, Dublin 4, D04 Y5W9, Ireland",standard,2022-01-28,750000,3,2,End of Terrace,125.0,Buy,0,1028.0,DNG Begley,DNG Begley,BRANDED_AGENT,14.0,False,False,False,D2,-7.724514,53.396385,-6.2420516,53.3249331
3689479,"9 Carrigmore Oak, Fortunestown, Dublin, Ireland",standard,2022-01-28,275000,3,3,Duplex,111.0,Buy,0,363.0,Peter Wyse,Peter Wyse,BRANDED_AGENT,18.0,False,True,False,C3,-6.236884,53.281157,-6.4311022,53.283047
3683476,"55 Dowth Ave, Cabra East, Dublin 7, D07 XK0N, Ireland",standard,2022-01-29,425000,3,1,Terrace,73.0,Buy,0,8806.0,Isabelle Crean,BidX1,BRANDED_AGENT,12.0,False,False,False,D2,-6.430331,53.323421,-6.2828012,53.3619512
3683477,"116 St Attracta Rd, Cabra East, Dublin 7, D07 T251, Ireland",standard,2022-01-29,400000,2,2,Terrace,106.0,Buy,0,6182.0,Robert Lawson,Lisney (Leeson St),BRANDED_AGENT,12.0,True,False,False,E1,-6.232969,53.318003,-6.284572799999999,53.366309
3689427,"87a, 15 Beechwood Downs, Hartstown, Dublin, D15 Y0FP, Ireland",standard,2022-01-28,275000,2,2,Detached,106.0,Buy,0,8806.0,Isabelle Crean,BidX1,BRANDED_AGENT,3.0,False,False,False,C2,-9.045362,52.455375,-6.417483,53.39709939999999
3689399,"42 Charnwood Grove, Clonsilla, Dublin, D15 E3H9, Ireland",standard,2022-01-30,375000,3,3,Semi-D,95.0,Buy,0,2760.0,Peter Kearney MIPAV MMCEPI,Rooney Auctioneers -Limerick,BRANDED_AGENT,15.0,False,False,False,C2,-8.633671,52.66014,-6.4159907,53.38654289999999
3689360,"Prospect Hill, Finglas Rd, Finglas, Dublin 11, Ireland",standard,2022-01-28,235000,2,2,Apartment,60.0,Buy,0,1223.0,William O'Connell,O'Connell Auctioneers,BRANDED_AGENT,14.0,False,False,False,C1,-8.643072,52.147504,-6.2906336,53.3804835
3689319,"Apartment 16, La Rochelle, 49 High St, The Liberties, Dublin 8, Ireland",standard,2022-01-27,295000,2,1,Apartment,69.0,Buy,0,12233.0,Colin Smyth,dVW Smyth,UNBRANDED_AGENT,8.0,True,False,False,D2,-6.279145,53.309836,-6.2749159,53.3431177
3689302,"Castleside Dr, Dublin, Ireland",standard,2022-01-30,295000,1,1,Apartment,42.0,Buy,0,542.0,Flynn and Associates Raheny,Flynn & Associates Ltd (Raheny),BRANDED_AGENT,18.0,True,False,False,B1,-6.2423861,53.3634252,-6.2808815,53.2985691
3689207,"Rathmines Town Centre, Rathmines Rd Lower, Rathmines, Dublin 6, Ireland",standard,2022-01-25,415000,3,1,Apartment,67.0,Buy,0,841.0,Fiona McGowan,Mason Estates Phibsboro,BRANDED_AGENT,13.0,False,False,False,B3,-6.172278,53.404656,-6.2646117,53.325356
3689158,"21 Plunkett Ave, Finglas West, Dublin, D11 N7Y5, Ireland",standard,2022-01-27,295000,3,2,Terrace,110.0,Buy,0,2534.0,Nora Meaney,Sherry FitzGerald McDermott,BRANDED_AGENT,18.0,False,False,False,G,-6.944798,52.845932,-6.308655099999999,53.39793539999999
3689135,"The Weavers, Meath Pl, Saint Catherine's, Dublin 8, D08 RTT2, Ireland",standard,2022-01-26,275000,2,1,Townhouse,65.0,Buy,0,8210.0,Ray Kelly (Residential Sales),HWP Residential and Commercial Property,BRANDED_AGENT,10.0,False,False,False,D1,-6.430858,53.329183,-6.280200799999999,53.3411247
3689100,"151 Bremore Castle, Tankardstown, Balbriggan, Co. Dublin, K32 YX37, Ireland",standard,2022-01-30,235000,2,1,Semi-D,72.0,Buy,0,3928.0,Grainne Hennessy,East Cork Properties,UNBRANDED_AGENT,20.0,False,False,False,D1,-7.85614,51.952708,-6.1967709,53.6158747
3689073,"14 Mask Cres, Donaghmede, Dublin 5, D05 R5X7, Ireland",standard,2022-01-27,395000,3,1,Terrace,93.0,Buy,0,10104.0,Conor O'Regan,DNG Tallaght,BRANDED_AGENT,13.0,False,False,False,XXX,-6.344265,53.292622,-6.1980757,53.3830831
3689052,"23 Applewood Ave E, Holybanks, Swords, Co. Dublin, K67 H362, Ireland",standard,2022-01-30,275000,2,1,Duplex,72.0,Buy,0,11062.0,Auctioneera Dublin Office*,Auctioneera.ie,UNBRANDED_AGENT,21.0,False,False,False,C2,-6.27907,53.348851,-6.230607099999999,53.4696138
3689051,"6 Foxhill Lawn, Donaghmede, Dublin 13, D13 E2N6, Ireland",standard,2022-01-30,380000,3,1,Semi-D,112.0,Buy,0,6654.0,Kevin,DNG Boyce Gallagher,UNBRANDED_AGENT,22.0,True,False,False,C2,-7.757092,54.971284,-6.175012,53.3951406
3689048,"20j, 15 Fernleigh Dr, Carpenterstown, Dublin, D15 X2P0, Ireland",standard,2022-01-25,275000,2,2,Apartment,74.0,Buy,0,924.0,Karen Germaine,Sherry Fitzgerald Brady O'Flaherty,BRANDED_AGENT,8.0,False,False,False,D2,-6.589063,53.383321,-6.4033403,53.37367520000001
3689047,"19 Beverton Rise, Ballisk Common, Donabate, Co. Dublin, K36 TX09, Ireland",standard,2022-01-25,320000,2,2,Terrace,82.0,Buy,0,12120.0,Deirdre O'Gara,Mullery O'Gara Estate Agents,BRANDED_AGENT,13.0,False,True,False,D1,-6.287248,53.309787,-6.1528772,53.49040549999999
3689033,"14 Turnberry, Warrenhouse Rd, Burrow, Dublin 13, D13 F9K3, Ireland",standard,2022-01-25,525000,4,3,Semi-D,112.0,Buy,0,5210.0,Jim Payne,Jim Payne Property Consultants Ltd,UNBRANDED_AGENT,27.0,False,False,False,C1,-6.453968,53.362275,-6.1265807,53.3941931
3688989,"132 Woodview Heights, Doddsborough, Lucan, Co. Dublin, K78 N8H3, Ireland",standard,2022-01-25,335000,3,2,Semi-D,98.0,Buy,0,7410.0,Mike Kennedy,Dingle Properties,UNBRANDED_AGENT,30.0,False,False,False,B2,-10.26723,52.140538,-6.4649931,53.3513694
3550030,"44 Leeson Park, Ranelagh, Dublin 6, Ireland",standard,2022-01-28,2450000,6,5,Terrace,294.0,Buy,0,11754.0,Cormac Sheehy,Remax Team Earley,BRANDED_AGENT,15.0,False,False,False,D1,-8.185125,53.616807,-6.2513939,53.32803089999999
3688899,"15 Carpenterstown Road, Carpenterstown, Castleknock, Co. Dublin, Ireland",standard,2022-01-25,310000,3,2,Apartment,124.0,Buy,0,10661.0,Eoin O'Toole,Lisney (Howth Road),BRANDED_AGENT,18.0,False,False,False,E2,-6.2022145,53.3621541,-6.3909926,53.3760977
